<?xml version="1.0"?>
<dataDocument xmlns:xsi="http://www.w3.org/2001/XMLSchema-instance" xsi:schemaLocation="example-7.xsd example-7.xsd">
    <engineType>
        <engineDetail>
            <specificationRef href="xyz"/>
        </engineDetail>
        <specifications id="xyz">
            <powerUnit>HP</powerUnit>
            <cylinders>3</cylinders>
            <combustible>Gasoline</combustible>
            <manufacturer>ford</manufacturer>
        </specifications>
    </engineType>
</dataDocument>